Nome,Preco,Marca,Modelo
Pulverizador Elétrico Bomba Costal Bateria Manual 20 Litros,393,Agrícola Jardinagem Automático Resistente Duradouro,Brudden Mochila Pressão 10 Horas Bicos Leque
Kawashima Pulverizador Costal 2 Em 1 Elétrico E Manual 20 L ,353,Agrícola Jardinagem Automático Resistente Duradouro,Brudden Mochila Pressão 10 Horas Bicos Leque
Pulverizador Bomba 20l Costal Manual Agrícola - nagano,179,Agrícola Jardinagem Automático Resistente Duradouro,Brudden Mochila Pressão 10 Horas Bicos Leque
Pulverizador Borrifador Manual Costal 5l Palisad 647408,65,Agrícola Jardinagem Automático Resistente Duradouro,Brudden Mochila Pressão 10 Horas Bicos Leque
Pulverizador Costal 20 Litros Manual Agrícola 4 Bicos TP20,139,Agrícola Jardinagem Automático Resistente Duradouro,Brudden Mochila Pressão 10 Horas Bicos Leque
 Vonder PC020 Bomba Costal Pulverizador Agricola Manual 20 Litros ,193,Vonder,PC020
Pulverizador Elétrico Bomba Costal Bateria Manual 20 Litros,393,Agrícola Jardinagem Automático Resistente Duradouro,Brudden Mochila Pressão 10 Horas Bicos Leque
Pulverizador Costal Manual Agrícola 15 Litros Worker,179,Worker,15 LITROS
Pulverizador Costal Manual Jacto Pjh 20l Cor Azul,419,Worker,15 LITROS
Pulverizador Elétrico Costal 2 Em 1 Manual 20 Litros Yamaho Cor Vermelho,359,Yamaho,2 em 1
Pulverizador Costal Manual Borrifador Para Plantas 20 Litros,131,Yamaho,2 em 1
